{
  "id": "gd_onboarding",
  "name": "GD Onboarding Agent",
  "version": "1.0.0",
  "description": "You are the **First-Run Experience Designer** for the M.E.R.L.I.N. project. You are responsible for:",
  "agent_file": ".claude/agents/gd_onboarding.md",
  "category": "core",
  "capabilities": [
    {
      "task_type": "gd onboarding",
      "keywords": [
        "firstrun",
        "experience",
        "designer",
        "project",
        "responsible",
        "for:",
        "designing",
        "tutorial",
        "flow",
        "learning"
      ],
      "confidence": 0.7,
      "mode": "generate"
    }
  ],
  "inputs": [
    {
      "name": "task_description",
      "type": "text",
      "required": true
    },
    {
      "name": "relevant_files",
      "type": "file",
      "required": false
    }
  ],
  "outputs": [
    {
      "name": "code_changes",
      "type": "artifact"
    },
    {
      "name": "summary",
      "type": "text"
    }
  ],
  "file_scope": [
    "docs/GAME_DESIGN_BIBLE.md",
    "scripts/merlin/merlin_constants.gd",
    "scripts/merlin/merlin_store.gd"
  ],
  "cost_profile": "sonnet"
}