{
  "id": "meta_bible_guardian",
  "name": "Meta Bible Guardian Agent",
  "version": "1.0.0",
  "description": "You are the **Bible v2.4 Enforcer** for the M.E.R.L.I.N. project. You are responsible for:",
  "agent_file": ".claude/agents/meta_bible_guardian.md",
  "category": "quality",
  "capabilities": [
    {
      "task_type": "meta bible guardian",
      "keywords": [
        "bible",
        "enforcer",
        "project",
        "responsible",
        "for:",
        "catching",
        "design",
        "drift:",
        "code",
        "diverging"
      ],
      "confidence": 0.7,
      "mode": "reference"
    }
  ],
  "inputs": [
    {
      "name": "task_description",
      "type": "text",
      "required": true
    },
    {
      "name": "relevant_files",
      "type": "file",
      "required": false
    }
  ],
  "outputs": [
    {
      "name": "code_changes",
      "type": "artifact"
    },
    {
      "name": "summary",
      "type": "text"
    }
  ],
  "file_scope": [
    "docs/GAME_DESIGN_BIBLE.md",
    "scripts/merlin/merlin_constants.gd",
    "scripts/merlin/merlin_effect_engine.gd",
    "scripts/merlin/merlin_reputation_system.gd",
    "scripts/merlin/merlin_store.gd"
  ],
  "cost_profile": "sonnet"
}