{
  "id": "perf_mobile",
  "name": "Performance Mobile Agent",
  "version": "1.0.0",
  "description": "You are the **Mobile Compatibility Specialist** for the M.E.R.L.I.N. project. You are responsible for:",
  "agent_file": ".claude/agents/perf_mobile.md",
  "category": "creative",
  "capabilities": [
    {
      "task_type": "mobile",
      "keywords": [
        "mobile",
        "compatibility",
        "specialist",
        "project",
        "responsible",
        "for:",
        "adapting",
        "layout",
        "interaction",
        "touch"
      ],
      "confidence": 0.7,
      "mode": "build"
    }
  ],
  "inputs": [
    {
      "name": "task_description",
      "type": "text",
      "required": true
    },
    {
      "name": "relevant_files",
      "type": "file",
      "required": false
    }
  ],
  "outputs": [
    {
      "name": "code_changes",
      "type": "artifact"
    },
    {
      "name": "summary",
      "type": "text"
    }
  ],
  "file_scope": [
    "scripts/ui/merlin_game_controller.gd",
    "docs/70_graphic/UI_UX_BIBLE.md",
    "scripts/merlin/merlin_visual.gd"
  ],
  "cost_profile": "haiku"
}