{
  "id": "gd_narrative_flow",
  "name": "GD Narrative Flow Agent",
  "version": "1.0.0",
  "description": "You are the **Narrative Arc Designer** for the M.E.R.L.I.N. project. You are responsible for:",
  "agent_file": ".claude/agents/gd_narrative_flow.md",
  "category": "quality",
  "capabilities": [
    {
      "task_type": "gd narrative flow",
      "keywords": [
        "narrative",
        "designer",
        "project",
        "responsible",
        "for:",
        "designing",
        "story",
        "progression",
        "emerges",
        "naturally"
      ],
      "confidence": 0.7,
      "mode": "generate"
    }
  ],
  "inputs": [
    {
      "name": "task_description",
      "type": "text",
      "required": true
    },
    {
      "name": "relevant_files",
      "type": "file",
      "required": false
    }
  ],
  "outputs": [
    {
      "name": "code_changes",
      "type": "artifact"
    },
    {
      "name": "summary",
      "type": "text"
    }
  ],
  "file_scope": [
    "docs/GAME_DESIGN_BIBLE.md",
    "docs/LLM_ARCHITECTURE.md",
    "scripts/merlin/merlin_llm_adapter.gd",
    "addons/merlin_ai/merlin_ai.gd",
    "addons/merlin_ai/rag_manager.gd"
  ],
  "cost_profile": "opus"
}