{
  "id": "blender_ocean_animator",
  "name": "Blender Ocean Animator Agent — M.E.R.L.I.N.",
  "version": "1.0.0",
  "description": "**Summary**: Creates low-poly animated ocean surfaces with shape key waves and foam particles.",
  "agent_file": ".claude/agents/blender_ocean_animator.md",
  "category": "creative",
  "capabilities": [
    {
      "task_type": "blender ocean animator",
      "keywords": [
        "trigger=\"ocean",
        "waves",
        "water",
        "foam",
        "sea",
        "tidal\" action=\"invoke\" priority=\"medium\" -->"
      ],
      "confidence": 0.7,
      "mode": "generate"
    }
  ],
  "inputs": [
    {
      "name": "task_description",
      "type": "text",
      "required": true
    },
    {
      "name": "relevant_files",
      "type": "file",
      "required": false
    }
  ],
  "outputs": [
    {
      "name": "code_changes",
      "type": "artifact"
    },
    {
      "name": "summary",
      "type": "text"
    }
  ],
  "cost_profile": "haiku"
}