{
  "id": "audio_feedback",
  "name": "Audio Feedback Agent",
  "version": "1.0.0",
  "description": "You are the **Audio Feedback Specialist** for the M.E.R.L.I.N. project. You are responsible for:",
  "agent_file": ".claude/agents/audio_feedback.md",
  "category": "knowledge",
  "capabilities": [
    {
      "task_type": "audio feedback",
      "keywords": [
        "audio",
        "feedback",
        "specialist",
        "project",
        "responsible",
        "for:",
        "designing",
        "cues",
        "every"
      ],
      "confidence": 0.7,
      "mode": "generate"
    }
  ],
  "inputs": [
    {
      "name": "task_description",
      "type": "text",
      "required": true
    },
    {
      "name": "relevant_files",
      "type": "file",
      "required": false
    }
  ],
  "outputs": [
    {
      "name": "code_changes",
      "type": "artifact"
    },
    {
      "name": "summary",
      "type": "text"
    }
  ],
  "file_scope": [
    "scripts/merlin/",
    "scripts/ui/merlin_game_controller.gd",
    "scripts/merlin/merlin_effect_engine.gd",
    "docs/GAME_DESIGN_BIBLE.md"
  ],
  "cost_profile": "sonnet"
}